{
  "eventId": "66666666-6666-4666-8666-666666666666",
  "eventType": "nexusops.alert.recovered",
  "schemaVersion": 1,
  "occurredAt": "2026-08-26T10:15:00Z",
  "source": "opssight",
  "correlationId": "22222222-2222-4222-8222-222222222222",
  "payload": {
    "alertId": "33333333-3333-4333-8333-333333333333",
    "alertRuleId": "44444444-4444-4444-8444-444444444444",
    "checkId": "55555555-5555-4555-8555-555555555555",
    "status": "recovered",
    "severity": "critical",
    "message": "HTTP check recovered",
    "openedAt": "2026-08-26T10:00:00Z",
    "recoveredAt": "2026-08-26T10:15:00Z"
  }
}